{
    "object": "coin",
    "action": "post_transaction",
    "transaction_id": "K6GbqfHbCxLaihkDI88BEobHYNRKqYpASXp1QNSXPOo=",
    "transaction": {
	    "version": 1,
	    "inputs": [{
		    "tx_out_hash": "47DEQpj8HBSa--TImW-5JCeuQeRkm5NMpJWZG3hSuFU=",
		    "tx_out_index": 0,
		    "script": {
			    "type": "P2PKH",
			    "pubkey": "AAAAAAAAAAAAAAAAAAAAAAAAAAAAAAAAAAAAAAAAAAA=",
			    "sig": "CAFEBABE"
		    }
	    }],
	    "outputs": [{
		    "value": 9007199254740991,
		    "script": {
			    "type": "P2PKH",
			    "pubkey_hash": "2jmj7l5rSw0yVb-vlWAYkK-YBwk="
		    }
	    }],
	    "lock_time": 0
    }
}
