{
    "object": "coin",
    "action": "post_transaction",
    "transaction_id": "J4WK2mwS_hiBPxQLS6ujZ6WGXGg0ghBVZoZ0qB0NcoU=",
    "transaction": {
	    "version": 1,
	    "inputs": [{
		    "tx_out_hash": "01N1Y8twdu7wpdz5HLnkIeQSeuKpkNcQHeKF7XabLYU=",
		    "tx_out_index": 0,
		    "script": {
			    "type": "P2PKH",
			    "pubkey": "oKHk3AivbpNXk_SfFcHDaVHcCcY8IBfHE7auXJ7h4ms=",
			    "sig": "VcQ6RheWuDHNoXWSL2SZbMcOHJtSQ5Cwl7iho0p3ck-MoARUy3m_bidwXv7VOX4uxJu3J_SMlopPGgN47teSCA=="
		    }
	    }],
	    "outputs": [{
		    "value": 0,
		    "script": {
			    "type": "P2PKH",
			    "pubkey_hash": "2jmj7l5rSw0yVb-vlWAYkK-YBwk="
		    }
	    }],
	    "lock_time": 0
    }
}
