{
    "object": "coin",
    "action": "post_transaction",
    "transaction_id": "ESQimXKtIrt85EMSsmGoQ2kE2y1-ae6SAvp52Xp3KOQ=",
    "transaction": {
	    "version": 1,
	    "inputs": [{
		    "tx_out_hash": "01N1Y8twdu7wpdz5HLnkIeQSeuKpkNcQHeKF7XabLYU=",
		    "tx_out_index": 0,
		    "script": {
			    "type": "P2PKH",
			    "pubkey": "oKHk3AivbpNXk_SfFcHDaVHcCcY8IBfHE7auXJ7h4ms=",
			    "sig": "6hY16bDKnb7bRA5j7IMDR1CJDqAJKOLuQRgKxdpYQIrtSTVTRjo5jigqPhYQEPcK5a1WAF86V739ENFnlp6YCw=="
		    }
	    }],
	    "outputs": [{
		    "value": 32,
		    "script": {
			    "type": "P2PKH",
			    "pubkey_hash": "-_qR4IHwsiq50raa8jURNArds54="
		    }
	    }],
	    "lock_time": 0
    }
}
