{
    "object": "coin",
    "action": "post_transaction",
    "transaction_id": "JhHsVj7gqXX9jhfV56AYq1ATnWEPKHC6JAHN6J9k8i4=",
    "transaction": {
	    "version": 1,
	    "inputs": [{
		    "tx_out_hash": "AAAAAAAAAAAAAAAAAAAAAAAAAAAAAAAAAAAAAAAAAAA=",
		    "tx_out_index": 0,
		    "script": {
			    "type": "P2PKH",
			    "pubkey": "AAAAAAAAAAAAAAAAAAAAAAAAAAAAAAAAAAAAAAAAAAA=",
			    "sig": "CAFEBABE"
		    }
          },
            {
		    "tx_out_hash": "AAAAAAAAAAAAAAAAAAAAAAAAAAAAAAAAAAAAAAAAAAA=",
		    "tx_out_index": 0,
		    "script": {
			    "type": "P2PKH",
			    "pubkey": "AAAAAAAAAAAAAAAAAAAAAAAAAAAAAAAAAAAAAAAAAAA=",
			    "sig": "CAFEBABE"
		    }
        }],
	    "outputs": [{
		    "value": 32,
		    "script": {
			    "type": "P2PKH",
			    "pubkey_hash": "AAAAAAAAAAAAAAAAAAAAAAAAAAAAAAAAAAAAAAAAAAA="
		    }
	    },
                 {
		    "value": 32,
		    "script": {
			    "type": "P2PKH",
			    "pubkey_hash": "AAAAAAAAAAAAAAAAAAAAAAAAAAAAAAAAAAAAAAAAAAA="
		    }
	    }],
	    "lock_time": 0
    }
}
