{
    "object": "coin",
    "action": "post_transaction",
    "transaction_id": "oNtxrBVZaqA-6mNEEnqqSXWJMD5RGrdZBKfdkbbINLM=",
    "transaction": {
	    "version": 1,
	    "inputs": [{
		    "tx_out_hash": "AAAAAAAAAAAAAAAAAAAAAAAAAAAAAAAAAAAAAAAAAAA=",
		    "tx_out_index": 0,
		    "script": {
			    "type": "P2PKH",
			    "pubkey": "J9fBzJV70Jk5c-i3277Uq4CmeL4t53WDfUghaK0HpeM=",
			    "sig": "GmDtDAEQTlfSnlKAYrySIlDFpxte-5wUfPeyCFgPkHQ-A7s0-RbEfabD8vTbNwDRVhVpbwr_shlULSWpmmlWBg=="
		    }
	    }],
	    "outputs": [{
		    "value": 32,
		    "script": {
			    "type": "P2PKH",
			    "pubkey_hash": "SGnNfF533PBEUMYPMqBSQY83z5U="
		    }
	    }],
	    "lock_time": 0
    }
}