{
    "object": "coin",
    "action": "post_transaction",
    "transaction_id": "tckbNAMUVbkGX_v3Wy8d2XQjzf0q6MG72KL2cExCmHc=",
    "transaction": {
	    "version": 1,
	    "inputs": [{
		    "tx_out_hash": "01N1Y8twdu7wpdz5HLnkIeQSeuKpkNcQHeKF7XabLYU=",
		    "tx_out_index": 0,
		    "script": {
			    "type": "P2PKH",
			    "pubkey": "oKHk3AivbpNXk_SfFcHDaVHcCcY8IBfHE7auXJ7h4ms=",
			    "sig": "Egx9igwYeDRqpi3mVHFE-kEkpttjMgdKgfIl-umnr3DsH7RtZOAXULUnZFjkQijJNLx2tBPgMrIjnVTIh6bQAg=="
		    }
	    }],
	    "outputs": [{
		    "value": 9007199254740991,
		    "script": {
			    "type": "P2PKH",
			    "pubkey_hash": "2jmj7l5rSw0yVb-vlWAYkK-YBwk="
		    }
	    }],
	    "lock_time": 0
    }
}
